{
  "contract_version": "s4.coverage_report.v1",
  "metadata": {
    "job_id": "test_s4_job",
    "video_id": "test_video",
    "sector": "s4_asset_research",
    "generated_at": "2026-04-04T22:07:57.710911+00:00"
  },
  "target_coverage": [
    {
      "target_id": "t001",
      "coverage_state": "unresolved",
      "supporting_candidate_ids": [],
      "notes": "no candidates evaluated"
    }
  ],
  "scene_coverage": [
    {
      "scene_id": "scene_001",
      "coverage_state": "unresolved",
      "linked_target_ids": [
        "t001"
      ],
      "notes": "derived from 1 target(s): unresolved"
    }
  ],
  "unresolved_gaps": [
    "target t001: unresolved - no candidates evaluated",
    "scene scene_001: unresolved - derived from 1 target(s): unresolved"
  ],
  "warnings": [
    "no targets fully covered"
  ]
}